{"approvalReference":null,"approvedArtifacts":[{"artifactKind":"data-card","bytes":1724,"mediaType":"application/json","path":"objects/data-cards/sha256/e5/e59a62dfeb0c8df6274b92aca1ddc183deef2ee4cab67b0355ac53dbebc47a4d.json","sha256":"e59a62dfeb0c8df6274b92aca1ddc183deef2ee4cab67b0355ac53dbebc47a4d"},{"artifactKind":"deliberation-shard","bytes":1135,"mediaType":"application/x-ndjson","path":"objects/deliberations/sha256/59/59475c94afd610eacd36d9c9deff66ad9fe5d752903fe179c4a682b2126f56ad.jsonl","sha256":"59475c94afd610eacd36d9c9deff66ad9fe5d752903fe179c4a682b2126f56ad"},{"artifactKind":"record-shard","bytes":1058,"mediaType":"application/x-ndjson","path":"objects/records/sha256/bf/bf4b647def1a887c312a873f6982b1632c66743dde9f1a2988441d42373aaf7d.jsonl","sha256":"bf4b647def1a887c312a873f6982b1632c66743dde9f1a2988441d42373aaf7d"},{"artifactKind":"transcript-shard","bytes":1986,"mediaType":"application/x-ndjson","path":"objects/transcripts/sha256/45/45f79455d092936cf818294ade3d611721a332f4a11d6cca0f456f8c162c1919.jsonl","sha256":"45f79455d092936cf818294ade3d611721a332f4a11d6cca0f456f8c162c1919"}],"checks":{"contamination":{"evidence":[{"artifactPath":"objects/data-cards/sha256/e5/e59a62dfeb0c8df6274b92aca1ddc183deef2ee4cab67b0355ac53dbebc47a4d.json","artifactSha256":"e59a62dfeb0c8df6274b92aca1ddc183deef2ee4cab67b0355ac53dbebc47a4d","summary":"Synthetic fixture check evidence."}],"status":"pass"},"privacy":{"evidence":[{"artifactPath":"objects/data-cards/sha256/e5/e59a62dfeb0c8df6274b92aca1ddc183deef2ee4cab67b0355ac53dbebc47a4d.json","artifactSha256":"e59a62dfeb0c8df6274b92aca1ddc183deef2ee4cab67b0355ac53dbebc47a4d","summary":"Synthetic fixture check evidence."}],"status":"pass"},"quality":{"evidence":[{"artifactPath":"objects/data-cards/sha256/e5/e59a62dfeb0c8df6274b92aca1ddc183deef2ee4cab67b0355ac53dbebc47a4d.json","artifactSha256":"e59a62dfeb0c8df6274b92aca1ddc183deef2ee4cab67b0355ac53dbebc47a4d","summary":"Synthetic fixture check evidence."}],"status":"pass"},"rights":{"evidence":[{"artifactPath":"objects/data-cards/sha256/e5/e59a62dfeb0c8df6274b92aca1ddc183deef2ee4cab67b0355ac53dbebc47a4d.json","artifactSha256":"e59a62dfeb0c8df6274b92aca1ddc183deef2ee4cab67b0355ac53dbebc47a4d","summary":"Synthetic fixture check evidence."}],"status":"pass"},"safety":{"evidence":[{"artifactPath":"objects/data-cards/sha256/e5/e59a62dfeb0c8df6274b92aca1ddc183deef2ee4cab67b0355ac53dbebc47a4d.json","artifactSha256":"e59a62dfeb0c8df6274b92aca1ddc183deef2ee4cab67b0355ac53dbebc47a4d","summary":"Synthetic fixture check evidence."}],"status":"pass"},"secrets":{"evidence":[{"artifactPath":"objects/data-cards/sha256/e5/e59a62dfeb0c8df6274b92aca1ddc183deef2ee4cab67b0355ac53dbebc47a4d.json","artifactSha256":"e59a62dfeb0c8df6274b92aca1ddc183deef2ee4cab67b0355ac53dbebc47a4d","summary":"Synthetic fixture check evidence."}],"status":"pass"},"sourceOwnership":{"evidence":[{"artifactPath":"objects/data-cards/sha256/e5/e59a62dfeb0c8df6274b92aca1ddc183deef2ee4cab67b0355ac53dbebc47a4d.json","artifactSha256":"e59a62dfeb0c8df6274b92aca1ddc183deef2ee4cab67b0355ac53dbebc47a4d","summary":"Synthetic fixture check evidence."}],"status":"pass"},"transcriptPolicy":{"evidence":[{"artifactPath":"objects/data-cards/sha256/e5/e59a62dfeb0c8df6274b92aca1ddc183deef2ee4cab67b0355ac53dbebc47a4d.json","artifactSha256":"e59a62dfeb0c8df6274b92aca1ddc183deef2ee4cab67b0355ac53dbebc47a4d","summary":"Synthetic fixture check evidence."}],"status":"pass"}},"datasetId":"d06-social-causality","disposition":"approve_public","policy":{"path":"policies/publication-trust-v2.json","policyId":"rappterverse-publication-trust","policyVersion":"2.0.0","sha256":"c6ff35dcb7821473b517ef8096c03f29c0234f6c9980f301b8f54c5c9a8b0207"},"predecessor":null,"providerRedistributionApproval":null,"reasonCodes":["synthetic-fixture-approved"],"reviewId":"review-d06-core-leaves-v2","reviewedAt":"2026-07-12T20:00:00Z","reviewer":"kody-w","schemaVersion":"rappterverse.public-review-receipt/v2","scope":"dataset-leaves"}
