{"approvalReference":null,"approvedArtifacts":[{"artifactKind":"data-card","bytes":1724,"mediaType":"application/json","path":"objects/data-cards/sha256/b2/b2386472fbee8aa3a4c03f77868f910998412498c663bc311f7ad1232f477f37.json","sha256":"b2386472fbee8aa3a4c03f77868f910998412498c663bc311f7ad1232f477f37"},{"artifactKind":"deliberation-shard","bytes":1135,"mediaType":"application/x-ndjson","path":"objects/deliberations/sha256/43/43d2054887bce5eabcf1d54c5d8d8a7613d34998315655936572d7e9e71d7d19.jsonl","sha256":"43d2054887bce5eabcf1d54c5d8d8a7613d34998315655936572d7e9e71d7d19"},{"artifactKind":"record-shard","bytes":1058,"mediaType":"application/x-ndjson","path":"objects/records/sha256/9b/9bc7a8c94e16d4885a59d43b3a4d1c4339fbc7d8af1eff9e07fa872cb73fff42.jsonl","sha256":"9bc7a8c94e16d4885a59d43b3a4d1c4339fbc7d8af1eff9e07fa872cb73fff42"},{"artifactKind":"transcript-shard","bytes":1986,"mediaType":"application/x-ndjson","path":"objects/transcripts/sha256/11/119f05fed4cd3e1454a362310f8387443688950af5af41444c51c760a4138e29.jsonl","sha256":"119f05fed4cd3e1454a362310f8387443688950af5af41444c51c760a4138e29"}],"checks":{"contamination":{"evidence":[{"artifactPath":"objects/data-cards/sha256/b2/b2386472fbee8aa3a4c03f77868f910998412498c663bc311f7ad1232f477f37.json","artifactSha256":"b2386472fbee8aa3a4c03f77868f910998412498c663bc311f7ad1232f477f37","summary":"Synthetic fixture check evidence."}],"status":"pass"},"privacy":{"evidence":[{"artifactPath":"objects/data-cards/sha256/b2/b2386472fbee8aa3a4c03f77868f910998412498c663bc311f7ad1232f477f37.json","artifactSha256":"b2386472fbee8aa3a4c03f77868f910998412498c663bc311f7ad1232f477f37","summary":"Synthetic fixture check evidence."}],"status":"pass"},"quality":{"evidence":[{"artifactPath":"objects/data-cards/sha256/b2/b2386472fbee8aa3a4c03f77868f910998412498c663bc311f7ad1232f477f37.json","artifactSha256":"b2386472fbee8aa3a4c03f77868f910998412498c663bc311f7ad1232f477f37","summary":"Synthetic fixture check evidence."}],"status":"pass"},"rights":{"evidence":[{"artifactPath":"objects/data-cards/sha256/b2/b2386472fbee8aa3a4c03f77868f910998412498c663bc311f7ad1232f477f37.json","artifactSha256":"b2386472fbee8aa3a4c03f77868f910998412498c663bc311f7ad1232f477f37","summary":"Synthetic fixture check evidence."}],"status":"pass"},"safety":{"evidence":[{"artifactPath":"objects/data-cards/sha256/b2/b2386472fbee8aa3a4c03f77868f910998412498c663bc311f7ad1232f477f37.json","artifactSha256":"b2386472fbee8aa3a4c03f77868f910998412498c663bc311f7ad1232f477f37","summary":"Synthetic fixture check evidence."}],"status":"pass"},"secrets":{"evidence":[{"artifactPath":"objects/data-cards/sha256/b2/b2386472fbee8aa3a4c03f77868f910998412498c663bc311f7ad1232f477f37.json","artifactSha256":"b2386472fbee8aa3a4c03f77868f910998412498c663bc311f7ad1232f477f37","summary":"Synthetic fixture check evidence."}],"status":"pass"},"sourceOwnership":{"evidence":[{"artifactPath":"objects/data-cards/sha256/b2/b2386472fbee8aa3a4c03f77868f910998412498c663bc311f7ad1232f477f37.json","artifactSha256":"b2386472fbee8aa3a4c03f77868f910998412498c663bc311f7ad1232f477f37","summary":"Synthetic fixture check evidence."}],"status":"pass"},"transcriptPolicy":{"evidence":[{"artifactPath":"objects/data-cards/sha256/b2/b2386472fbee8aa3a4c03f77868f910998412498c663bc311f7ad1232f477f37.json","artifactSha256":"b2386472fbee8aa3a4c03f77868f910998412498c663bc311f7ad1232f477f37","summary":"Synthetic fixture check evidence."}],"status":"pass"}},"datasetId":"d09-failure-recovery","disposition":"approve_public","policy":{"path":"policies/publication-trust-v2.json","policyId":"rappterverse-publication-trust","policyVersion":"2.0.0","sha256":"c6ff35dcb7821473b517ef8096c03f29c0234f6c9980f301b8f54c5c9a8b0207"},"predecessor":null,"providerRedistributionApproval":null,"reasonCodes":["synthetic-fixture-approved"],"reviewId":"review-d09-core-leaves-v2","reviewedAt":"2026-07-12T20:00:00Z","reviewer":"kody-w","schemaVersion":"rappterverse.public-review-receipt/v2","scope":"dataset-leaves"}
